{
  "transportId": "38134ea09c99a748e12a879c57a2f8aa328a81221eb3c624f13bad617f95235b",
  "logicalEventKey": "5fd6f3e2def620bfd251ee1948078283c30cb0bc7a51ee50d15fcd0c25c7ba46",
  "source": "Report",
  "messageType": "SentForSettle",
  "occurredAtUtc": "2026-09-03T10:01:00Z",
  "receivedAtUtc": "2026-09-04T08:00:00Z",
  "payloadHash": "6d1ecfc4262a25618fdd8c97f32b66fae3cb5a0025f2e924f3c9e491dfb1e3e5",
  "merchantAccount": "GenesisMerchant",
  "environment": "Test",
  "pspReference": "9911234567890123",
  "originalPspReference": "8831234567890123",
  "merchantReference": "ORDER-1001",
  "shopperReference": "C10000",
  "paymentMethod": "visa",
  "successProvided": true,
  "success": true,
  "currencyCode": "EUR",
  "amount": 123.45,
  "reportRunId": "payments_accounting_report_2026_09_03.csv",
  "reportRowIdentity": "6d1ecfc4262a25618fdd8c97f32b66fae3cb5a0025f2e924f3c9e491dfb1e3e5",
  "rawArchiveReference": "https://storage.example/adyen-reports/2026/09/04/example.csv"
}

