{
  "transportId": "28134ea09c99a748e12a879c57a2f8aa328a81221eb3c624f13bad617f95235b",
  "logicalEventKey": "genesismerchant|authorisation|8831234567890123|true",
  "source": "Webhook",
  "messageType": "AUTHORISATION",
  "occurredAtUtc": "2026-09-03T10:00:00Z",
  "receivedAtUtc": "2026-09-03T10:00:01Z",
  "payloadHash": "7d1ecfc4262a25618fdd8c97f32b66fae3cb5a0025f2e924f3c9e491dfb1e3e5",
  "merchantAccount": "GenesisMerchant",
  "environment": "Test",
  "pspReference": "8831234567890123",
  "originalPspReference": "",
  "merchantReference": "ORDER-1001",
  "shopperReference": "C10000",
  "paymentMethod": "visa",
  "successProvided": true,
  "success": true,
  "currencyCode": "EUR",
  "amount": 123.45,
  "reportRunId": "",
  "reportRowIdentity": "",
  "rawArchiveReference": "https://storage.example/adyen-webhooks-raw/2026/09/03/example.json"
}

